{
  "$schema": "./credentials.schema.json",
  "name": "barApi",
  "displayName": "Bar API",
  "documentionUrl": "https://docs.bar.com",
  "icon": "file:bar.svg",
  "properties": [
    {
      "displayName": "API Key",
      "name": "apiKey",
      "type": "string",
      "required": true,
      "typeOptions": {
        "password": true
      },
      "default": ""
    }
  ],
  "authenticate": {
    "type": "generic",
    "properties": {
      "headers": {
        "X-API-Key": "={{$credentials.apiKey}}"
      }
    }
  },
  "test": {
    "request": {
      "url": "https://api.bar.com/v1/status"
    }
  }
}
